{"schema_version":"ptk.package-manifest/1","package_version":"0.2.0-contract-vector","rid":"osx-arm64","private_protocol_version":2,"public_contract_sha256":"db732bfe3fb4b01ddb4d53d977414868f3fbbe2edea083c17a0194f3baa73e00","host_build_sha256":"10d586d35c220f1df8654d07754c18d1f359542619ecbf4d0e373c4392a15fb0","files":[{"path":"VERSION","role":"version","bytes":21,"sha256":"1111111111111111111111111111111111111111111111111111111111111111","unix_mode":420},{"path":"bin/PtkAuditAdmin","role":"audit_admin","bytes":101,"sha256":"2222222222222222222222222222222222222222222222222222222222222222","unix_mode":493},{"path":"bin/PtkContainmentBroker","role":"containment_helper","bytes":102,"sha256":"3333333333333333333333333333333333333333333333333333333333333333","unix_mode":493},{"path":"bin/PtkGuardianBroker","role":"guardian_helper","bytes":103,"sha256":"4444444444444444444444444444444444444444444444444444444444444444","unix_mode":493},{"path":"bin/PtkMcpGuardian","role":"guardian_apphost","bytes":104,"sha256":"5555555555555555555555555555555555555555555555555555555555555555","unix_mode":493},{"path":"bin/PtkMcpGuardian.dll","role":"guardian_managed","bytes":105,"sha256":"6666666666666666666666666666666666666666666666666666666666666666","unix_mode":420},{"path":"bin/PtkMcpServer","role":"host_apphost","bytes":106,"sha256":"7777777777777777777777777777777777777777777777777777777777777777","unix_mode":493},{"path":"bin/PtkMcpServer.dll","role":"host_managed","bytes":107,"sha256":"8888888888888888888888888888888888888888888888888888888888888888","unix_mode":420},{"path":"bin/PtkMcpServer.runtimeconfig.json","role":"host_runtime","bytes":108,"sha256":"9999999999999999999999999999999999999999999999999999999999999999","unix_mode":420},{"path":"bin/PtkSharedContracts.dll","role":"shared_contract","bytes":109,"sha256":"aaaaaaaaaaaaaaaaaaaaaaaaaaaaaaaaaaaaaaaaaaaaaaaaaaaaaaaaaaaaaaaa","unix_mode":420},{"path":"scripts/ptk_init.ps1","role":"script","bytes":110,"sha256":"bbbbbbbbbbbbbbbbbbbbbbbbbbbbbbbbbbbbbbbbbbbbbbbbbbbbbbbbbbbbbbbb","unix_mode":420},{"path":"src/PwshTokenCompressor.psm1","role":"module","bytes":111,"sha256":"cccccccccccccccccccccccccccccccccccccccccccccccccccccccccccccccc","unix_mode":420}]}
